{
  "config_revision": "1",
  "config_sha256": "597ddb66cfb45d86f0c9dfab5340eb5dd099924bec51bf54a5fcf5ef5a9e7412",
  "dimensions": [
    {
      "kind": "continuous_grid",
      "name": "object_initial_position_x_m",
      "unit": "m",
      "values": [
        0.84,
        1.1
      ]
    },
    {
      "kind": "continuous_grid",
      "name": "object_initial_position_y_m",
      "unit": "m",
      "values": [
        0.18,
        0.38
      ]
    }
  ],
  "frozen_factors": {
    "appearance_profile_id": "red_default_v1",
    "camera_profile_id": "front_rgbd_640x360_v1",
    "controller_profile_id": "hybrid_rmpflow_lula_ik_v1",
    "lighting_profile_id": "distant_1000_v1",
    "material_id": "high_friction_default_v1",
    "object_dimensions_m": [
      0.055,
      0.055,
      0.055
    ],
    "object_initial_z_m": 0.5,
    "object_mass_kg": 0.08,
    "object_shape": "cube",
    "object_yaw_degrees": 0.0,
    "physics_profile_id": "physx_contact_pickup_v1",
    "recording_profile_id": "farpoint_multimodal_v1",
    "robot_pose_profile_id": "ur10e_tabletop_v1",
    "target_position_m": [
      0.96,
      -0.03,
      0.42
    ]
  },
  "grid": {
    "columns": 5,
    "interior_fraction": [
      0.1,
      0.9
    ],
    "primary_slots_per_cell": 3,
    "reserve_candidates_per_slot": 2,
    "rows": 5,
    "x_bounds_m": [
      0.84,
      1.1
    ],
    "y_bounds_m": [
      0.18,
      0.38
    ]
  },
  "plan_id": "farpoint_v1_3_cube_position_expanded_candidate",
  "plan_sha256": "f13bb891d6044145a0e2c5b65982f91810298f0a8387328cc933fb51bd0da8db",
  "planner_revision": "cube-position-grid-v1",
  "planner_sha256": "b3e1d20f43fb6bac28408b4c0f5ca5885079c3d0c3c4500a1cab93c55fa95b4e",
  "schema_version": "farpoint.variation.v2",
  "task_id": "isaac_perception_contact_scene",
  "trials": [
    {
      "cell_id": "r00_c00",
      "column": 0,
      "object_position_xy_m": [
        0.866794398,
        0.197914445
      ],
      "reserve_candidates": [
        {
          "candidate_id": "r00_c00_s00_reserve1",
          "object_position_xy_m": [
            0.868920519,
            0.190738527
          ],
          "reserve_index": 1,
          "seed": 9023203582840700086,
          "seed_material": {
            "cell_column": 0,
            "cell_row": 0,
            "plan_id": "farpoint_v1_3_cube_position_expanded_candidate",
            "reserve_index": 1,
            "schema_version": "farpoint.variation.v2",
            "slot": 0
          }
        },
        {
          "candidate_id": "r00_c00_s00_reserve2",
          "object_position_xy_m": [
            0.870455093,
            0.202907253
          ],
          "reserve_index": 2,
          "seed": 5652791473444963493,
          "seed_material": {
            "cell_column": 0,
            "cell_row": 0,
            "plan_id": "farpoint_v1_3_cube_position_expanded_candidate",
            "reserve_index": 2,
            "schema_version": "farpoint.variation.v2",
            "slot": 0
          }
        }
      ],
      "row": 0,
      "seed": 6033686403206759099,
      "seed_material": {
        "cell_column": 0,
        "cell_row": 0,
        "plan_id": "farpoint_v1_3_cube_position_expanded_candidate",
        "reserve_index": 0,
        "schema_version": "farpoint.variation.v2",
        "slot": 0
      },
      "slot": 0,
      "split": "train",
      "trial_id": "primary_r00_c00_s00",
      "variation_id": "position_r00_c00_s00"
    },
    {
      "cell_id": "r00_c00",
      "column": 0,
      "object_position_xy_m": [
        0.879568716,
        0.215844996
      ],
      "reserve_candidates": [
        {
          "candidate_id": "r00_c00_s01_reserve1",
          "object_position_xy_m": [
            0.876757382,
            0.206741841
          ],
          "reserve_index": 1,
          "seed": 5554232988153977508,
          "seed_material": {
            "cell_column": 0,
            "cell_row": 0,
            "plan_id": "farpoint_v1_3_cube_position_expanded_candidate",
            "reserve_index": 1,
            "schema_version": "farpoint.variation.v2",
            "slot": 1
          }
        },
        {
          "candidate_id": "r00_c00_s01_reserve2",
          "object_position_xy_m": [
            0.850530916,
            0.208330652
          ],
          "reserve_index": 2,
          "seed": 3098748304480344125,
          "seed_material": {
            "cell_column": 0,
            "cell_row": 0,
            "plan_id": "farpoint_v1_3_cube_position_expanded_candidate",
            "reserve_index": 2,
            "schema_version": "farpoint.variation.v2",
            "slot": 1
          }
        }
      ],
      "row": 0,
      "seed": 542263525448028650,
      "seed_material": {
        "cell_column": 0,
        "cell_row": 0,
        "plan_id": "farpoint_v1_3_cube_position_expanded_candidate",
        "reserve_index": 0,
        "schema_version": "farpoint.variation.v2",
        "slot": 1
      },
      "slot": 1,
      "split": "train",
      "trial_id": "primary_r00_c00_s01",
      "variation_id": "position_r00_c00_s01"
    },
    {
      "cell_id": "r00_c00",
      "column": 0,
      "object_position_xy_m": [
        0.875261679,
        0.211997841
      ],
      "reserve_candidates": [
        {
          "candidate_id": "r00_c00_s02_reserve1",
          "object_position_xy_m": [
            0.883145474,
            0.199982385
          ],
          "reserve_index": 1,
          "seed": 902650939247138178,
          "seed_material": {
            "cell_column": 0,
            "cell_row": 0,
            "plan_id": "farpoint_v1_3_cube_position_expanded_candidate",
            "reserve_index": 1,
            "schema_version": "farpoint.variation.v2",
            "slot": 2
          }
        },
        {
          "candidate_id": "r00_c00_s02_reserve2",
          "object_position_xy_m": [
            0.847193468,
            0.210054734
          ],
          "reserve_index": 2,
          "seed": 6179063012581349256,
          "seed_material": {
            "cell_column": 0,
            "cell_row": 0,
            "plan_id": "farpoint_v1_3_cube_position_expanded_candidate",
            "reserve_index": 2,
            "schema_version": "farpoint.variation.v2",
            "slot": 2
          }
        }
      ],
      "row": 0,
      "seed": 8657346004354404575,
      "seed_material": {
        "cell_column": 0,
        "cell_row": 0,
        "plan_id": "farpoint_v1_3_cube_position_expanded_candidate",
        "reserve_index": 0,
        "schema_version": "farpoint.variation.v2",
        "slot": 2
      },
      "slot": 2,
      "split": "validation",
      "trial_id": "primary_r00_c00_s02",
      "variation_id": "position_r00_c00_s02"
    },
    {
      "cell_id": "r00_c01",
      "column": 1,
      "object_position_xy_m": [
        0.937914576,
        0.184106697
      ],
      "reserve_candidates": [
        {
          "candidate_id": "r00_c01_s00_reserve1",
          "object_position_xy_m": [
            0.923313725,
            0.185474644
          ],
          "reserve_index": 1,
          "seed": 8138884230000062359,
          "seed_material": {
            "cell_column": 1,
            "cell_row": 0,
            "plan_id": "farpoint_v1_3_cube_position_expanded_candidate",
            "reserve_index": 1,
            "schema_version": "farpoint.variation.v2",
            "slot": 0
          }
        },
        {
          "candidate_id": "r00_c01_s00_reserve2",
          "object_position_xy_m": [
            0.910085006,
            0.189894017
          ],
          "reserve_index": 2,
          "seed": 3061759367861995288,
          "seed_material": {
            "cell_column": 1,
            "cell_row": 0,
            "plan_id": "farpoint_v1_3_cube_position_expanded_candidate",
            "reserve_index": 2,
            "schema_version": "farpoint.variation.v2",
            "slot": 0
          }
        }
      ],
      "row": 0,
      "seed": 3896262432025958038,
      "seed_material": {
        "cell_column": 1,
        "cell_row": 0,
        "plan_id": "farpoint_v1_3_cube_position_expanded_candidate",
        "reserve_index": 0,
        "schema_version": "farpoint.variation.v2",
        "slot": 0
      },
      "slot": 0,
      "split": "train",
      "trial_id": "primary_r00_c01_s00",
      "variation_id": "position_r00_c01_s00"
    },
    {
      "cell_id": "r00_c01",
      "column": 1,
      "object_position_xy_m": [
        0.901382462,
        0.214176934
      ],
      "reserve_candidates": [
        {
          "candidate_id": "r00_c01_s01_reserve1",
          "object_position_xy_m": [
            0.917564394,
            0.21164774
          ],
          "reserve_index": 1,
          "seed": 6355560439885469043,
          "seed_material": {
            "cell_column": 1,
            "cell_row": 0,
            "plan_id": "farpoint_v1_3_cube_position_expanded_candidate",
            "reserve_index": 1,
            "schema_version": "farpoint.variation.v2",
            "slot": 1
          }
        },
        {
          "candidate_id": "r00_c01_s01_reserve2",
          "object_position_xy_m": [
            0.914141183,
            0.21445088
          ],
          "reserve_index": 2,
          "seed": 7373618572488445000,
          "seed_material": {
            "cell_column": 1,
            "cell_row": 0,
            "plan_id": "farpoint_v1_3_cube_position_expanded_candidate",
            "reserve_index": 2,
            "schema_version": "farpoint.variation.v2",
            "slot": 1
          }
        }
      ],
      "row": 0,
      "seed": 7000982240293800611,
      "seed_material": {
        "cell_column": 1,
        "cell_row": 0,
        "plan_id": "farpoint_v1_3_cube_position_expanded_candidate",
        "reserve_index": 0,
        "schema_version": "farpoint.variation.v2",
        "slot": 1
      },
      "slot": 1,
      "split": "train",
      "trial_id": "primary_r00_c01_s01",